### ISSUE TITLE
dg3f_m_driver.launch.py fails to work: Unknown Model

### ISSUE THREAD

**Issue by quajak** [tesollodelto/delto_m_ros2#9]
When using `ros2 launch dg3f_m_driver dg3f_m_driver.launch.py`, the launch never completes as `/dg3f_m/controller_manager/list_controllers` never publishes. Additionally, it complains that the model is unkown (0x0000) rather than DG3F-M (0x3F02).

The hardware is set in positions 1 (external control) and 4 (ethernet). 

```
[INFO] [launch]: All log files can be found below /root/.ros/log/2026-03-09-19-00-20-291060-50da8a113277-237784
[INFO] [launch]: Default logging verbosity is set to INFO
[INFO] [ros2_control_node-1]: process started with pid [237792]
[INFO] [robot_state_publisher-2]: process started with pid [237794]
[INFO] [spawner-3]: process started with pid [237796]
[INFO] [spawner-4]: process started with pid [237798]
[ros2_control_node-1] [INFO] [1773082820.730463130] [dg3f_m.controller_manager]: Subscribing to '~/robot_description' topic for robot description file.
[ros2_control_node-1] [INFO] [1773082820.731283032] [dg3f_m.controller_manager]: update rate is 100 Hz
[ros2_control_node-1] [INFO] [1773082820.731304525] [dg3f_m.controller_manager]: Spawning controller_manager RT thread with scheduler priority: 50
[ros2_control_node-1] [WARN] [1773082820.731411456] [dg3f_m.controller_manager]: Could not enable FIFO RT scheduling policy: with error number <1>(Operation not permitted). See [https://control.ros.org/master/doc/ros2_control/controller_manager/doc/userdoc.html] for details on how to enable realtime scheduling.
[robot_state_publisher-2] [INFO] [1773082820.732354730] [dg3f_m.robot_state_publisher]: got segment base_link
[robot_state_publisher-2] [INFO] [1773082820.732441632] [dg3f_m.robot_state_publisher]: got segment fingertip_1
[robot_state_publisher-2] [INFO] [1773082820.732449975] [dg3f_m.robot_state_publisher]: got segment fingertip_2
[robot_state_publisher-2] [INFO] [1773082820.732455019] [dg3f_m.robot_state_publisher]: got segment fingertip_3
[robot_state_publisher-2] [INFO] [1773082820.732459299] [dg3f_m.robot_state_publisher]: got segment l_dg_1_1
[robot_state_publisher-2] [INFO] [1773082820.732463692] [dg3f_m.robot_state_publisher]: got segment l_dg_1_2
[robot_state_publisher-2] [INFO] [1773082820.732467918] [dg3f_m.robot_state_publisher]: got segment l_dg_1_3
[robot_state_publisher-2] [INFO] [1773082820.732472052] [dg3f_m.robot_state_publisher]: got segment l_dg_1_4
[robot_state_publisher-2] [INFO] [1773082820.732476155] [dg3f_m.robot_state_publisher]: got segment l_dg_1_tip
[robot_state_publisher-2] [INFO] [1773082820.732480350] [dg3f_m.robot_state_publisher]: got segment l_dg_2_1
[robot_state_publisher-2] [INFO] [1773082820.732484631] [dg3f_m.robot_state_publisher]: got segment l_dg_2_2
[robot_state_publisher-2] [INFO] [1773082820.732488793] [dg3f_m.robot_state_publisher]: got segment l_dg_2_3
[robot_state_publisher-2] [INFO] [1773082820.732492994] [dg3f_m.robot_state_publisher]: got segment l_dg_2_4
[robot_state_publisher-2] [INFO] [1773082820.732497122] [dg3f_m.robot_state_publisher]: got segment l_dg_2_tip
[robot_state_publisher-2] [INFO] [1773082820.732501499] [dg3f_m.robot_state_publisher]: got segment l_dg_3_1
[robot_state_publisher-2] [INFO] [1773082820.732505647] [dg3f_m.robot_state_publisher]: got segment l_dg_3_2
[robot_state_publisher-2] [INFO] [1773082820.732509777] [dg3f_m.robot_state_publisher]: got segment l_dg_3_3
[robot_state_publisher-2] [INFO] [1773082820.732513926] [dg3f_m.robot_state_publisher]: got segment l_dg_3_4
[robot_state_publisher-2] [INFO] [1773082820.732518006] [dg3f_m.robot_state_publisher]: got segment l_dg_3_tip
[robot_state_publisher-2] [INFO] [1773082820.732522222] [dg3f_m.robot_state_publisher]: got segment l_dg_base
[robot_state_publisher-2] [INFO] [1773082820.732526397] [dg3f_m.robot_state_publisher]: got segment l_dg_mount
[ros2_control_node-1] [INFO] [1773082820.733813939] [dg3f_m.controller_manager]: Received robot description file.
[ros2_control_node-1] [INFO] [1773082820.734239489] [resource_manager]: Loading hardware 'dg3f_m_driver' 
[ros2_control_node-1] [INFO] [1773082820.736332606] [resource_manager]: Initialize hardware 'dg3f_m_driver' 
[ros2_control_node-1] [INFO] [1773082820.736962258] [SystemInterface]: Delto model: 0x3F02, Fingers: 3, Joints: 12
[ros2_control_node-1] [INFO] [1773082820.736981398] [SystemInterface]: Supports F/T: yes, Supports GPIO: yes
[ros2_control_node-1] [INFO] [1773082820.737268711] [SystemInterface]: Attempting to connect to 169.254.186.72:502
[ros2_control_node-1] 0,3,8
[spawner-3] [INFO] [1773082820.757880284] [spawner_joint_state_broadcaster]: waiting for service /dg3f_m/controller_manager/list_controllers to become available...
[spawner-4] [INFO] [1773082820.771906477] [spawner_dg3f_m_controller]: waiting for service /dg3f_m/controller_manager/list_controllers to become available...
[ros2_control_node-1] ========================================
[ros2_control_node-1] Device Info:
[ros2_control_node-1]   Firmware Version: 3.1
[ros2_control_node-1]   Configured Model: DG3F-M (0x3F02)
[ros2_control_node-1]   Actual Model:     Unknown (0x0000)
[ros2_control_node-1] ========================================
[ros2_control_node-1] Connected to Delto Gripper (Model: Unknown (0x0000), Motors: 12)
[ros2_control_node-1] ========================================
[ros2_control_node-1] WARNING: Model mismatch detected!
[ros2_control_node-1]   Expected: DG3F-M (0x3F02)
[ros2_control_node-1]   Got:      Unknown (0x0000)
[ros2_control_node-1]   Please check your URDF/xacro configuration.
[ros2_control_node-1] ========================================
[ros2_control_node-1] [INFO] [1773082820.944554709] [SystemInterface]: Successfully connected. Firmware: v3.1, Motor direction revised: yes
[ros2_control_node-1] [INFO] [1773082820.951615176] [resource_manager]: Successful initialization of hardware 'dg3f_m_driver'
[ros2_control_node-1] [INFO] [1773082820.952020239] [resource_manager]: 'configure' hardware 'dg3f_m_driver' 
[ros2_control_node-1] [INFO] [1773082820.952039398] [resource_manager]: Successful 'configure' of hardware 'dg3f_m_driver'
[ros2_control_node-1] [INFO] [1773082820.952068157] [resource_manager]: 'activate' hardware 'dg3f_m_driver' 
[ros2_control_node-1] [INFO] [1773082820.952075990] [SystemInterface]: Activating driver...
[ros2_control_node-1] [INFO] [1773082820.952086117] [SystemInterface]: Driver activated successfully!
[ros2_control_node-1] [INFO] [1773082820.952094736] [resource_manager]: Successful 'activate' of hardware 'dg3f_m_driver'
[ros2_control_node-1] [INFO] [1773082821.011699571] [dg3f_m.controller_manager]: Loading controller 'joint_state_broadcaster'
[spawner-3] [WARN] [1773082831.013967267] [spawner_joint_state_broadcaster]: Failed getting a result from calling /dg3f_m/controller_manager/load_controller in 10.0. (Attempt 1 of 3.)
[spawner-4] [WARN] [1773082831.024660669] [spawner_dg3f_m_controller]: Failed getting a result from calling /dg3f_m/controller_manager/list_controllers in 10.0. (Attempt 1 of 3.)
[spawner-3] [WARN] [1773082841.015357791] [spawner_joint_state_broadcaster]: Failed getting a result from calling /dg3f_m/controller_manager/load_controller in 10.0. (Attempt 2 of 3.)
[spawner-4] [WARN] [1773082841.026029233] [spawner_dg3f_m_controller]: Failed getting a result from calling /dg3f_m/controller_manager/list_controllers in 10.0. (Attempt 2 of 3.)
[spawner-3] [WARN] [1773082851.017188620] [spawner_joint_state_broadcaster]: Failed getting a result from calling /dg3f_m/controller_manager/load_controller in 10.0. (Attempt 3 of 3.)
[spawner-3] Traceback (most recent call last):
[spawner-3]   File "/opt/ros/humble/lib/controller_manager/spawner", line 33, in <module>
[spawner-3]     sys.exit(load_entry_point('controller-manager==2.53.1', 'console_scripts', 'spawner')())
[spawner-3]   File "/opt/ros/humble/local/lib/python3.10/dist-packages/controller_manager/spawner.py", line 227, in main
[spawner-3]     ret = load_controller(node, controller_manager_name, controller_name)
[spawner-3]   File "/opt/ros/humble/local/lib/python3.10/dist-packages/controller_manager/controller_manager_services.py", line 227, in load_controller
[spawner-3]     return service_caller(
[spawner-3]   File "/opt/ros/humble/local/lib/python3.10/dist-packages/controller_manager/controller_manager_services.py", line 150, in service_caller
[spawner-3]     raise RuntimeError(
[spawner-3] RuntimeError: Could not successfully call service /dg3f_m/controller_manager/load_controller after 3 attempts.
[spawner-4] [WARN] [1773082851.027563180] [spawner_dg3f_m_controller]: Failed getting a result from calling /dg3f_m/controller_manager/list_controllers in 10.0. (Attempt 3 of 3.)
[spawner-4] Traceback (most recent call last):
[spawner-4]   File "/opt/ros/humble/lib/controller_manager/spawner", line 33, in <module>
[spawner-4]     sys.exit(load_entry_point('controller-manager==2.53.1', 'console_scripts', 'spawner')())
[spawner-4]   File "/opt/ros/humble/local/lib/python3.10/dist-packages/controller_manager/spawner.py", line 195, in main
[spawner-4]     if is_controller_loaded(
[spawner-4]   File "/opt/ros/humble/local/lib/python3.10/dist-packages/controller_manager/spawner.py", line 67, in is_controller_loaded
[spawner-4]     controllers = list_controllers(
[spawner-4]   File "/opt/ros/humble/local/lib/python3.10/dist-packages/controller_manager/controller_manager_services.py", line 172, in list_controllers
[spawner-4]     return service_caller(
[spawner-4]   File "/opt/ros/humble/local/lib/python3.10/dist-packages/controller_manager/controller_manager_services.py", line 150, in service_caller
[spawner-4]     raise RuntimeError(
[spawner-4] RuntimeError: Could not successfully call service /dg3f_m/controller_manager/list_controllers after 3 attempts.
[ERROR] [spawner-3]: process has died [pid 237796, exit code 1, cmd '/opt/ros/humble/lib/controller_manager/spawner joint_state_broadcaster -c /dg3f_m/controller_manager --ros-args'].
[ERROR] [spawner-4]: process has died [pid 237798, exit code 1, cmd '/opt/ros/humble/lib/controller_manager/spawner dg3f_m_controller -c /dg3f_m/controller_manager --ros-args'].
```

**Comment by Kim-Hongcheol** [comment]
@quajak 

<img width="508" height="698" alt="Image" src="https://github.com/user-attachments/assets/ddfb7fac-d8ef-4df7-9cef-bc7bbf6331f3" />

Thank you for your inquiry.

You mentioned that the current setting is 1–4, which corresponds to Operator Mode.
In this environment, the system operates properly only when it is configured in Developer Mode. Therefore, could you please change the switch setting to 2–4 and check the operation again?

Also, after changing the switch setting, please power-cycle the device so that the change is applied.

**Comment by quajak** [comment]
Thank you for your quick reply. We are using 1-4 because when in 2-4, it fails to setup a working connection. This behavior is the same if we use the m driver incorrectly, or the correct b driver. Please see the logs below: 
```
root@50da8a113277:/home/root/src/delto_m_ros2# ros2 launch dg3f_b_driver dg3f_b_driver.launch.py delto_ip:=169.254.186.72 delto_port:=502
[INFO] [launch]: All log files can be found below /root/.ros/log/2026-03-11-15-44-38-004617-50da8a113277-24413
[INFO] [launch]: Default logging verbosity is set to INFO
[INFO] [ros2_control_node-1]: process started with pid [24415]
[INFO] [robot_state_publisher-2]: process started with pid [24417]
[INFO] [spawner-3]: process started with pid [24419]
[INFO] [spawner-4]: process started with pid [24421]
[ros2_control_node-1] [INFO] [1773243878.113867033] [dg3f_b.controller_manager]: Subscribing to '~/robot_description' topic for robot description file.
[ros2_control_node-1] [INFO] [1773243878.114243746] [dg3f_b.controller_manager]: update rate is 100 Hz
[ros2_control_node-1] [INFO] [1773243878.114253679] [dg3f_b.controller_manager]: Spawning controller_manager RT thread with scheduler priority: 50
[ros2_control_node-1] [WARN] [1773243878.114310194] [dg3f_b.controller_manager]: Could not enable FIFO RT scheduling policy: with error number <1>(Operation not permitted). See [https://control.ros.org/master/doc/ros2_control/controller_manager/doc/userdoc.html] for details on how to enable realtime scheduling.
[robot_state_publisher-2] [INFO] [1773243878.116926305] [dg3f_b.robot_state_publisher]: got segment F1_01
[robot_state_publisher-2] [INFO] [1773243878.116973442] [dg3f_b.robot_state_publisher]: got segment F1_02
[robot_state_publisher-2] [INFO] [1773243878.116977400] [dg3f_b.robot_state_publisher]: got segment F1_03
[robot_state_publisher-2] [INFO] [1773243878.116979759] [dg3f_b.robot_state_publisher]: got segment F1_04
[robot_state_publisher-2] [INFO] [1773243878.116981932] [dg3f_b.robot_state_publisher]: got segment F1_TIP
[robot_state_publisher-2] [INFO] [1773243878.116983991] [dg3f_b.robot_state_publisher]: got segment F2_01
[robot_state_publisher-2] [INFO] [1773243878.116986036] [dg3f_b.robot_state_publisher]: got segment F2_02
[robot_state_publisher-2] [INFO] [1773243878.116988013] [dg3f_b.robot_state_publisher]: got segment F2_03
[robot_state_publisher-2] [INFO] [1773243878.116989986] [dg3f_b.robot_state_publisher]: got segment F2_04
[robot_state_publisher-2] [INFO] [1773243878.116991826] [dg3f_b.robot_state_publisher]: got segment F2_TIP
[robot_state_publisher-2] [INFO] [1773243878.116993724] [dg3f_b.robot_state_publisher]: got segment F3_01
[robot_state_publisher-2] [INFO] [1773243878.116995623] [dg3f_b.robot_state_publisher]: got segment F3_02
[robot_state_publisher-2] [INFO] [1773243878.116997503] [dg3f_b.robot_state_publisher]: got segment F3_03
[robot_state_publisher-2] [INFO] [1773243878.116999483] [dg3f_b.robot_state_publisher]: got segment F3_04
[robot_state_publisher-2] [INFO] [1773243878.117001320] [dg3f_b.robot_state_publisher]: got segment F3_TIP
[robot_state_publisher-2] [INFO] [1773243878.117003278] [dg3f_b.robot_state_publisher]: got segment base_link
[robot_state_publisher-2] [INFO] [1773243878.117005178] [dg3f_b.robot_state_publisher]: got segment delto_base_link
[ros2_control_node-1] [INFO] [1773243878.117154247] [dg3f_b.controller_manager]: Received robot description file.
[ros2_control_node-1] [INFO] [1773243878.117416313] [resource_manager]: Loading hardware 'dg3f_b_driver' 
[ros2_control_node-1] [INFO] [1773243878.118832134] [resource_manager]: Initialize hardware 'dg3f_b_driver' 
[ros2_control_node-1] [INFO] [1773243878.119242130] [SystemInterface]: Delto model: 0x3F01, Fingers: 3, Joints: 12
[ros2_control_node-1] [INFO] [1773243878.119254251] [SystemInterface]: Supports F/T: no, Supports GPIO: yes
[ros2_control_node-1] [INFO] [1773243878.119449784] [SystemInterface]: Attempting to connect to 169.254.186.72:502
[ros2_control_node-1] 0,3,8
[spawner-3] [INFO] [1773243878.306175848] [spawner_joint_state_broadcaster]: waiting for service /dg3f_b/controller_manager/list_controllers to become available...
[spawner-4] [INFO] [1773243878.331301274] [spawner_dg3f_b_controller]: waiting for service /dg3f_b/controller_manager/list_controllers to become available...
[spawner-3] [WARN] [1773243888.324891573] [spawner_joint_state_broadcaster]: Could not contact service /dg3f_b/controller_manager/list_controllers
[spawner-3] [INFO] [1773243888.325364874] [spawner_joint_state_broadcaster]: waiting for service /dg3f_b/controller_manager/list_controllers to become available...
[spawner-4] [WARN] [1773243888.349632193] [spawner_dg3f_b_controller]: Could not contact service /dg3f_b/controller_manager/list_controllers
[spawner-4] [INFO] [1773243888.350029848] [spawner_dg3f_b_controller]: waiting for service /dg3f_b/controller_manager/list_controllers to become available...
[spawner-3] [WARN] [1773243898.345377429] [spawner_joint_state_broadcaster]: Could not contact service /dg3f_b/controller_manager/list_controllers
[spawner-3] [INFO] [1773243898.346385387] [spawner_joint_state_broadcaster]: waiting for service /dg3f_b/controller_manager/list_controllers to become available...
[spawner-4] [WARN] [1773243898.368261074] [spawner_dg3f_b_controller]: Could not contact service /dg3f_b/controller_manager/list_controllers
[spawner-4] [INFO] [1773243898.368690559] [spawner_dg3f_b_controller]: waiting for service /dg3f_b/controller_manager/list_controllers to become available...
```
For the communication between the gripper and PC see here:
```
root@50da8a113277:/home/root/src/delto_m_ros2# tcpdump -X -i eth0 host 169.254.186.72 and port 502
tcpdump: verbose output suppressed, use -v[v]... for full protocol decode
listening on eth0, link-type EN10MB (Ethernet), snapshot length 262144 bytes
15:44:38.119742 IP 50da8a113277.57098 > 169.254.186.72.502: Flags [S], seq 726578365, win 64240, options [mss 1460,sackOK,TS val 1413106479 ecr 0,nop,wscale 7], length 0
        0x0000:  4500 003c fb91 4000 4006 2ed0 ac11 0002  E..<..@.@.......
        0x0010:  a9fe ba48 df0a 01f6 2b4e b4bd 0000 0000  ...H....+N......
        0x0020:  a002 faf0 1089 0000 0204 05b4 0402 080a  ................
        0x0030:  543a 4b2f 0000 0000 0103 0307            T:K/........
15:44:38.119888 IP 169.254.186.72.502 > 50da8a113277.57098: Flags [S.], seq 780608594, ack 726578366, win 2048, options [mss 1460], length 0
        0x0000:  4500 002c 0007 4000 7f06 eb6a a9fe ba48  E..,..@....j...H
        0x0010:  ac11 0002 01f6 df0a 2e87 2452 2b4e b4be  ..........$R+N..
        0x0020:  6012 0800 6bd5 0000 0204 05b4            `...k.......
15:44:38.119902 IP 50da8a113277.57098 > 169.254.186.72.502: Flags [.], ack 1, win 64240, length 0
        0x0000:  4500 0028 fb92 4000 4006 2ee3 ac11 0002  E..(..@.@.......
        0x0010:  a9fe ba48 df0a 01f6 2b4e b4be 2e87 2453  ...H....+N....$S
        0x0020:  5010 faf0 1075 0000                      P....u..
15:44:38.119968 IP 50da8a113277.57098 > 169.254.186.72.502: Flags [P.], seq 1:4, ack 1, win 64240, length 3
        0x0000:  4500 002b fb93 4000 4006 2edf ac11 0002  E..+..@.@.......
        0x0010:  a9fe ba48 df0a 01f6 2b4e b4be 2e87 2453  ...H....+N....$S
        0x0020:  5018 faf0 1078 0000 0003 08              P....x.....
15:44:38.120040 IP 169.254.186.72.502 > 50da8a113277.57098: Flags [.], ack 4, win 2045, length 0
        0x0000:  4500 0028 0008 4000 7f06 eb6d a9fe ba48  E..(..@....m...H
        0x0010:  ac11 0002 01f6 df0a 2e87 2453 2b4e b4c1  ..........$S+N..
        0x0020:  5010 07fd 8392 0000                      P.......
15:44:38.386970 IP 169.254.186.72.502 > 50da8a113277.57098: Flags [.], ack 4, win 2047, length 0
        0x0000:  4500 0028 0009 4000 7f06 eb6c a9fe ba48  E..(..@....l...H
        0x0010:  ac11 0002 01f6 df0a 2e87 2453 2b4e b4c1  ..........$S+N..
        0x0020:  5010 07ff 8390 0000                      P.......
15:44:38.386977 IP 169.254.186.72.502 > 50da8a113277.57098: Flags [.], ack 4, win 2048, length 0
        0x0000:  4500 0028 000a 4000 7f06 eb6b a9fe ba48  E..(..@....k...H
        0x0010:  ac11 0002 01f6 df0a 2e87 2453 2b4e b4c1  ..........$S+N..
        0x0020:  5010 0800 838f 0000                      P.......
15:45:10.365815 IP 50da8a113277.57098 > 169.254.186.72.502: Flags [F.], seq 4, ack 1, win 64240, length 0
        0x0000:  4500 0028 fb94 4000 4006 2ee1 ac11 0002  E..(..@.@.......
        0x0010:  a9fe ba48 df0a 01f6 2b4e b4c1 2e87 2453  ...H....+N....$S
        0x0020:  5011 faf0 1075 0000                      P....u..
15:45:10.366095 IP 169.254.186.72.502 > 50da8a113277.57098: Flags [.], ack 5, win 2048, length 0
        0x0000:  4500 0028 000b 4000 7f06 eb6a a9fe ba48  E..(..@....j...H
        0x0010:  ac11 0002 01f6 df0a 2e87 2453 2b4e b4c2  ..........$S+N..
        0x0020:  5010 0800 838e 0000                      P.......
15:45:10.366124 IP 169.254.186.72.502 > 50da8a113277.57098: Flags [F.], seq 1, ack 5, win 2048, length 0
        0x0000:  4500 0028 000c 4000 7f06 eb69 a9fe ba48  E..(..@....i...H
        0x0010:  ac11 0002 01f6 df0a 2e87 2453 2b4e b4c2  ..........$S+N..
        0x0020:  5011 0800 838d 0000                      P.......
15:45:10.366138 IP 50da8a113277.57098 > 169.254.186.72.502: Flags [.], ack 2, win 64240, length 0
        0x0000:  4500 0028 0000 4000 4006 2a76 ac11 0002  E..(..@.@.*v....
        0x0010:  a9fe ba48 df0a 01f6 2b4e b4c2 2e87 2454  ...H....+N....$T
        0x0020:  5010 faf0 909c 0000                      P.......
```



When running in 1-4 we again have the same issue as before: 
```
root@50da8a113277:/home/root/src/delto_m_ros2# ros2 launch dg3f_b_driver dg3f_b_driver.launch.py delto_ip:=169.254.186.72 delto_port:=502
[INFO] [launch]: All log files can be found below /root/.ros/log/2026-03-11-15-40-35-153445-50da8a113277-21688
[INFO] [launch]: Default logging verbosity is set to INFO
[INFO] [ros2_control_node-1]: process started with pid [21697]
[INFO] [robot_state_publisher-2]: process started with pid [21699]
[INFO] [spawner-3]: process started with pid [21701]
[INFO] [spawner-4]: process started with pid [21703]
[robot_state_publisher-2] [INFO] [1773243635.250162598] [dg3f_b.robot_state_publisher]: got segment F1_01
[robot_state_publisher-2] [INFO] [1773243635.250207867] [dg3f_b.robot_state_publisher]: got segment F1_02
[robot_state_publisher-2] [INFO] [1773243635.250211749] [dg3f_b.robot_state_publisher]: got segment F1_03
[robot_state_publisher-2] [INFO] [1773243635.250213851] [dg3f_b.robot_state_publisher]: got segment F1_04
[robot_state_publisher-2] [INFO] [1773243635.250215775] [dg3f_b.robot_state_publisher]: got segment F1_TIP
[robot_state_publisher-2] [INFO] [1773243635.250217671] [dg3f_b.robot_state_publisher]: got segment F2_01
[robot_state_publisher-2] [INFO] [1773243635.250219632] [dg3f_b.robot_state_publisher]: got segment F2_02
[robot_state_publisher-2] [INFO] [1773243635.250221567] [dg3f_b.robot_state_publisher]: got segment F2_03
[robot_state_publisher-2] [INFO] [1773243635.250223520] [dg3f_b.robot_state_publisher]: got segment F2_04
[robot_state_publisher-2] [INFO] [1773243635.250225282] [dg3f_b.robot_state_publisher]: got segment F2_TIP
[robot_state_publisher-2] [INFO] [1773243635.250227297] [dg3f_b.robot_state_publisher]: got segment F3_01
[robot_state_publisher-2] [INFO] [1773243635.250229148] [dg3f_b.robot_state_publisher]: got segment F3_02
[robot_state_publisher-2] [INFO] [1773243635.250230923] [dg3f_b.robot_state_publisher]: got segment F3_03
[robot_state_publisher-2] [INFO] [1773243635.250232711] [dg3f_b.robot_state_publisher]: got segment F3_04
[robot_state_publisher-2] [INFO] [1773243635.250234482] [dg3f_b.robot_state_publisher]: got segment F3_TIP
[robot_state_publisher-2] [INFO] [1773243635.250236338] [dg3f_b.robot_state_publisher]: got segment base_link
[robot_state_publisher-2] [INFO] [1773243635.250238112] [dg3f_b.robot_state_publisher]: got segment delto_base_link
[ros2_control_node-1] [INFO] [1773243635.250540452] [dg3f_b.controller_manager]: Subscribing to '~/robot_description' topic for robot description file.
[ros2_control_node-1] [INFO] [1773243635.250903027] [dg3f_b.controller_manager]: update rate is 100 Hz
[ros2_control_node-1] [INFO] [1773243635.250912395] [dg3f_b.controller_manager]: Spawning controller_manager RT thread with scheduler priority: 50
[ros2_control_node-1] [WARN] [1773243635.250967614] [dg3f_b.controller_manager]: Could not enable FIFO RT scheduling policy: with error number <1>(Operation not permitted). See [https://control.ros.org/master/doc/ros2_control/controller_manager/doc/userdoc.html] for details on how to enable realtime scheduling.
[ros2_control_node-1] [INFO] [1773243635.261211810] [dg3f_b.controller_manager]: Received robot description file.
[ros2_control_node-1] [INFO] [1773243635.261476639] [resource_manager]: Loading hardware 'dg3f_b_driver' 
[ros2_control_node-1] [INFO] [1773243635.262914250] [resource_manager]: Initialize hardware 'dg3f_b_driver' 
[ros2_control_node-1] [INFO] [1773243635.263305467] [SystemInterface]: Delto model: 0x3F01, Fingers: 3, Joints: 12
[ros2_control_node-1] [INFO] [1773243635.263316766] [SystemInterface]: Supports F/T: no, Supports GPIO: yes
[ros2_control_node-1] [INFO] [1773243635.263517758] [SystemInterface]: Attempting to connect to 169.254.186.72:502
[ros2_control_node-1] 0,3,8
[spawner-3] [INFO] [1773243635.422678923] [spawner_joint_state_broadcaster]: waiting for service /dg3f_b/controller_manager/list_controllers to become available...
[spawner-4] [INFO] [1773243635.443133927] [spawner_dg3f_b_controller]: waiting for service /dg3f_b/controller_manager/list_controllers to become available...
[ros2_control_node-1] 0,3,8,0,0,3,1
[ros2_control_node-1] ========================================
[ros2_control_node-1] Device Info:
[ros2_control_node-1]   Firmware Version: 3.1
[ros2_control_node-1]   Configured Model: DG3F-B (0x3F01)
[ros2_control_node-1]   Actual Model:     Unknown (0x0000)0
[ros2_control_node-1] ========================================
[ros2_control_node-1] Connected to Delto Gripper (Model: Unknown (0x0000), Motors: 12)
[ros2_control_node-1] ========================================
[ros2_control_node-1] WARNING: Model mismatch detected!
[ros2_control_node-1]   Expected: DG3F-B (0x3F01)
[ros2_control_node-1]   Got:      Unknown (0x0000)
[ros2_control_node-1]   Please check your URDF/xacro configuration.
[ros2_control_node-1] ========================================
[ros2_control_node-1] [WARN] [1773243635.486298027] [SystemInterface]: Firmware v3.1 is older than v3.6. Using legacy motor direction.
[ros2_control_node-1] [INFO] [1773243635.486315162] [SystemInterface]: Successfully connected. Firmware: v3.1, Motor direction revised: no
[ros2_control_node-1] [INFO] [1773243635.489304072] [resource_manager]: Successful initialization of hardware 'dg3f_b_driver'
[ros2_control_node-1] [INFO] [1773243635.489488274] [resource_manager]: 'configure' hardware 'dg3f_b_driver' 
[ros2_control_node-1] [INFO] [1773243635.489497139] [resource_manager]: Successful 'configure' of hardware 'dg3f_b_driver'
[ros2_control_node-1] [INFO] [1773243635.489508894] [resource_manager]: 'activate' hardware 'dg3f_b_driver' 
[ros2_control_node-1] [INFO] [1773243635.489513337] [SystemInterface]: Activating driver...
[ros2_control_node-1] [INFO] [1773243635.489518383] [SystemInterface]: Driver activated successfully!
[ros2_control_node-1] [INFO] [1773243635.489523064] [resource_manager]: Successful 'activate' of hardware 'dg3f_b_driver'
[ros2_control_node-1] [INFO] [1773243635.677209384] [dg3f_b.controller_manager]: Loading controller 'joint_state_broadcaster'
```

**Comment by quajak** [comment]
Figured out that we still had the old 3F gripper and have to use https://github.com/tesollodelto/delto_b_ros2?tab=readme-ov-file
